date,month,title,body,mean_text_similarity,day,cars,light_commercial_vehicles,heavy_goods_vehicles,all_motor_vehicles,tfl_tube,tfl_bus,bus_excluding_london,national_rail,national_rail_noCR,cars_monthly_prop,light_commercial_vehicles_monthly_prop,heavy_goods_vehicles_monthly_prop,all_motor_vehicles_monthly_prop,tfl_tube_monthly_prop,tfl_bus_monthly_prop,bus_excluding_london_monthly_prop,national_rail_monthly_prop,national_rail_noCR_monthly_prop,cars_yearly_prop,light_commercial_vehicles_yearly_prop,heavy_goods_vehicles_yearly_prop,all_motor_vehicles_yearly_prop,tfl_tube_yearly_prop,tfl_bus_yearly_prop,bus_excluding_london_yearly_prop,national_rail_yearly_prop,national_rail_noCR_yearly_prop
2024-01-03,Jan, TfL advises Tube customers to only travel if their journey is essential during planned RMT strike,"Planned strike action by RMT members means severe disruption is expected across the Tube network from the evening of Sunday 7 January until the morning of Friday 12 January
 
 




 ""We are disappointed that RMT is planning strike action in response to our offer of a five per cent pay increase""
 
 Glynn Barton
 TfL's Chief Operating Officer
 


 
Customers who need to travel advised to consider alternative routes
The Elizabeth line, London Overground, DLR, London Trams and London buses are scheduled to operate as normal but may be subject to last-minute changes and will be much busier than usual
TfL has been engaging constructively with the RMT and other trade unions over a pay increase for London Underground staff and has made a full and final offer of a five per cent increase, which ASLEF members have accepted
Transport for London (TfL) is advising customers that there will be severe disruption across the Tube network, with little or no service expected between the evening of Sunday 7 January and the morning of Friday 12 January, if the planned strike by RMT members goes ahead.

TfL will operate as much of the network as possible, but it is currently expecting the following service throughout the week:

On Sunday 7 January, Tube services will end earlier than normal. Customers are advised to complete Tube journeys by 17:30, although lines serving the Emirates will try to remain open longer.  Football fans are encouraged to make their way straight to the trains after the match as services will start to close from 19:30 on those lines
From Monday 8 to Thursday 11 January, severe disruption is expected, with little to no Tube service expected to run
On Friday 12 January, Tube services will start later than normal, with a good service expected by 12:00
While Londoners will still be able to travel on London Overground, Elizabeth line, DLR and Tram services, they may be subject to last-minute changes, including non-stopping at some stations shared with London Underground, although TfL will do everything possible to keep these open at all times. TfL expects these services will be much busier than usual and customers are advised to check before they travel.

Talks between TfL and RMT are currently ongoing as TfL seeks to try and avoid this planned strike action, which is over pay and conditions. In November, TfL made a full and final offer to increase the base pay for all London Underground workers by five per cent and this was accepted by members of the ASLEF union.

London buses are also expected to operate normally during this planned strike action, but customers should leave more time for their journeys as it is expected that many routes will be extremely busy.

Walking or cycling may be quicker for some journeys and planning tools are available to plan walking journeys. Santander Cycles will be available, with teams ensuring that bikes are distributed at key locations according to demand. Rental e-scooters are also available to hire in some London boroughs.

Glynn Barton, TfL's Chief Operating Officer, said: ""We are disappointed that RMT is planning strike action in response to our offer of a five per cent pay increase. We have been clear throughout our productive discussions with our trade unions that this offer is the most we can afford while ensuring that we can operate safely, reliably and sustainably. We encourage the RMT to engage with us to avoid disruption for Londoners. We would like to advise anyone travelling during the strike days to check before they travel.""

TfL is supporting customers to choose alternative travel routes where possible through a comprehensive communications campaign, which includes station announcements, posters, emails and social media.

For the latest information on how TfL services are operating, please use TfL's real-time travel tools, including status updates, Journey Planner and TfL Go. Travel advice for the planned strike action is available at tfl.gov.uk/strikes",0.32766132301520867,Wed,0.8,0.94,0.83,0.83,0.72,0.74,0.67,NA,NA,0.9062821833161688,0.8681780016792611,0.8703527168732126,0.8986220472440944,0.9198606271777003,0.8523560209424084,0.8161683277962348,NA,NA,0.8461978273299029,0.8046734918156053,0.8015660685154975,0.8350781781101291,0.8946684005201561,0.8575663657189058,0.777420619364955,NA,NA
2024-01-05,Jan, Experience London for less with new partnership offers from TfL,"TfL and Historic Royal Palaces have joined forces to offer two-for-one tickets on London's top historical attractions, including Kensington Palace 
 
 




 ""We are thrilled to be launching this two-for-one offer for TfL customers to visit Kensington Palace for the first time, joining two other Historic Royal Palaces sites - the Tower of London and Hampton Court Palace - to offer great value to our visitors""
 
 Justine Locker
 Head of Kensington Palace
 


 
The offer will be also be valid during the February half-term making it perfect for families looking for activities to keep children entertained
Lee Valley VeloPark offers TfL customers a 20 per cent discount on three cycling Velodrome taster experiences
Until March, Londoners and visitors can visit four Merlin Entertainments attractions in the capital for less with a 30 per cent discount 
TfL's partnerships with leading attractions in the capital help to highlight the value and benefits of public transport as the ideal way to make the most of London this year
Transport for London (TfL) has joined forces with many of London's top attractions to offer savings on visits to Historic Royal Palaces, Merlin Entertainments London attractions, Lee Valley VeloPark and much-loved shows in the West End.

Historic Royal Palaces have teamed up with TfL to offer customers two-for-one entry to three historic palaces in London when using the TfL network. The promotion now includes Kensington Palace, alongside the Tower of London and Hampton Court Palace, and is extended to include the February half-term. To qualify for free tickets, one person from each party will need to show proof of travel via the TfL Oyster and Contactless app on arrival. Customers travelling on the network will be able to discover the home of Henry VIII and admire the Tudor kitchens at the Hampton Court Palace for half the usual price of entry. TfL customers are invited to apply the 2 for 1 deal on top of the existing 50 per cent discount between 8 January and 9 February for a huge saving on tickets to this iconic visitor attraction.

Londoners and visitors can also enjoy a Velodrome experience on an Olympic track with Lee Valley VeloPark offering TfL customers 20 per cent off three taster sessions. The activities include Velodrome taster, Velodrome and BMX taster, and Velodrome Flying Lap. The discount is valid until 31 March using the code 'TFL20' here. Upon arrival, one person from each party must show proof of travel using the TfL network using TfL Oyster and the Contactless app.

In December, TfL and Official London Theatre launched a 10 per cent discount on Theatre Tokens, which hundreds of people are now using during the Official London Theatre's New Year sale to book top theatre shows such as Wicked, Disney's The Lion King and Mrs. Doubtfire for even less, with tickets between £10 to £50.

TfL's partnership with Merlin Entertainments continues to offer TfL customers a 30 per cent discount at top London attractions until March, including Shrek's Adventure!, Madame Tussauds London, London Dungeon, SEA LIFE London Aquarium.

Julie Dixon, TfL's Head of Partnerships and Customer Information, said: ""We are delighted that our exclusive offers which now include the iconic Kensington Palace and Olympic Velodrome will offer Londoners and visitors travelling across the TfL network even more opportunities to enjoy more of our city for less.""

Justine Locker, Head of Kensington Palace, said: ""We are thrilled to be launching this two-for-one offer for TfL customers to visit Kensington Palace for the first time, joining two other Historic Royal Palaces sites - the Tower of London and Hampton Court Palace - to offer great value to our visitors. We especially look forward to welcoming everyone who travels on the TfL network to Kensington Palace during February half-term to walk in the footsteps of a young Queen Victoria and explore the magnificent State Apartments.""

Jeremy Northrop, General Manager at Lee Valley VeloPark, said: ""We're excited to extend a 20 per cent discount to TfL customers on our exhilarating cycling experiences at Lee Valley VeloPark. Join us with TfL and gear up to experience the Olympic legacy at Lee Valley VeloPark where you can discover the excitement of cycling on these iconic cycling tracks.""

Sara Holt, Group Marketing Director at Merlin Entertainments, said: ""We're so happy to continue our partnership with TfL and offer 30 per cent off at our four incredible central London attractions. From mingling with the stars during Awards season at Madame Tussauds London to discovering the wonder under the capital at SEA LIFE London Aquarium it's the best way to kick off 2024.""

For more information and terms and conditions visit tfl.gov.uk/deals",0.30013558760968756,Fri,0.81,0.95,0.86,0.84,0.83,0.96,0.71,NA,NA,0.917610710607621,0.8774139378673383,0.9018112488083889,0.9094488188976378,1.0603948896631823,1.1057591623036649,0.8648947951273532,NA,NA,0.8567753001715266,0.813233848111516,0.8305383360522022,0.8451393609789258,1.0313538505996243,1.1125185285002022,0.8238337906703254,NA,NA
2024-01-05,Jan, TfL advises of five weekends of planned works affecting southbound traffic through Blackwall Tunnel in January and February,"Southbound traffic will need to seek alternative routes across the weekends of 13-15 January, 20-22 January, 27-29 January (a contingency weekend if either of the previous two weekends are not possible),10-12 February and 24-26 February
 
 




 ""The Blackwall Tunnel is used by tens of thousands of vehicles every day and we appreciate that these planned weekend works will have an impact on some drivers""
 
 Carl Eddleston
 Director of Network Management and Resilience at TfL
 


 
Closure to southbound tunnel needed to allow TfL and Riverlinx CJV to carry out drainage and gantry installation works on the northbound Blackwall Tunnel approach to support the new Silvertown Tunnel, with northbound traffic diverted via the normal southbound tunnel
Route 108 will be temporarily split and terminate at Canning Town station and North Greenwich, with customers using the Jubilee line to cross the river to complete their journeys with subsequent refunds available if required
Transport for London (TfL) has today advised drivers that the Blackwall Tunnel will be closed to southbound traffic for five weekends in January and February to help support works to the northbound carriageway on the northbound Blackwall Tunnel approach.

The works, which are required to implement the road configuration for the new Silvertown Tunnel which will open in 2025, will see new drainage as well as new over-height vehicle gantries installed, which are necessary to protect the tunnel. The Silvertown Tunnel will provide a public transport-focused river crossing with zero-emission bus links across the Thames. Once open in 2025, the crossing, which is within the Ultra-Low Emission Zone and will be subject to a user charge, will also reduce congestion and improve the reliability and resilience of the Blackwall Tunnel, which will improve overall air quality in the local area.

The closures will take place across the weekends of 13-15 January, 20-22 January, 27-29 January (a contingency weekend if either of the previous two weekends are not possible),10-12 February and 24-26 February, starting at 00:01 on the Saturday morning and being reopened by 05:00 on the Monday morning at the latest.

Across the weekends, the Blackwall Tunnel will be closed for southbound traffic and drivers will need to take alternative routes. Northbound traffic will not be affected by these closures as traffic will be diverted through the southbound Blackwall Tunnel. However, there will be no access to Tunnel Avenue from the A102 at Pear Island across the weekend due to the works. The northbound on-slip on Blackwall Lane will also be closed and a signed diversion via the Woolwich Flyover roundabout will be in place. Drivers are advised to plan their routes in advance, checking before they travel so they can consider any other potential traffic impacts or restrictions, such as the height and weight limits at Rotherhithe Tunnel and Tower Bridge, both of which are outside the Congestion Charge zone.

During the weekend of the 24-26 February, northbound traffic will also be diverted from the A102 via Millennium Way to the Blackwall tunnel entrance from 22:00 until 08:00 to allow for additional works to install new gantries across all lanes of the A102.  

Drivers of HGVs, as well as vans more than two metres in height or weighing more than two tonnes, are advised to consider routes away from central London across the weekend where possible. To help inform drivers, additional variable messaging signs will be placed on the main roads approaching the Blackwall Tunnel. TfL has also worked with third party app providers, such as Waze, to help ensure drivers who regularly use the Blackwall Tunnel are alerted to the southbound closure and that the closure is shown in any route-planning over the weekend. TfL will also take the opportunity to carry out works within and around the tunnel, to help deliver future maintenance work more efficiently and ensure the tunnel can continue to safely operate. 

Carl Eddleston, Director of Network Management and Resilience at TfL, said: ""The Blackwall Tunnel is used by tens of thousands of vehicles every day and we appreciate that these planned weekend works will have an impact on some drivers. With less than 18 months until the new Silvertown Tunnel opens, we are working with Riverlinx CJV to prepare the northbound carriageway, and have worked hard to try and limit the potential disruption these will cause, such as ensuring a northbound route can be maintained throughout these closures.""

The route 108, the only bus route that operates through the Blackwall Tunnel, will be split in two, operating between both Lewisham and North Greenwich and between Canning Town and Stratford. Customers are advised to then change onto the Jubilee line to cross the river to complete their journeys. TfL will also ensure that customers of the route 108 who then use the Jubilee line as part of their journey over the weekend will avoid being charged for the Tube section of their journey via an automatic refund which will be processed after the weekend. The Mayor's Hopper fare will also mean that customers won't be charged for any additional bus journeys on the other side of the river, providing they begin within an hour of touching in on the first bus. From 00:01 on the Monday mornings of the closure, northbound buses will return to their normal route and southbound buses will be diverted via Tower Bridge until the tunnel is re-opened to southbound traffic.

Work on delivering the new Silvertown Tunnel, which will open in 2025, continues to progress. Both of the 1.1km tunnels have now been fully tunnelled and the 'cut and cover' sections are now in advanced stages of being covered. Throughout 2024 work will continue to install the safety critical systems within the tunnel, as well as complete work on the tunnel portals. Work is also progressing on the new road layout around Tidal Basin Roundabout in Newham, including new walking and cycling paths to make it easier for people accessing the Royal Docks via the Lower Lea Crossing.

For the latest on how roads are running, please visit: https://tfl.gov.uk/traffic/status/",0.22711302471727,Fri,0.81,0.95,0.86,0.84,0.83,0.96,0.71,NA,NA,0.917610710607621,0.8774139378673383,0.9018112488083889,0.9094488188976378,1.0603948896631823,1.1057591623036649,0.8648947951273532,NA,NA,0.8567753001715266,0.813233848111516,0.8305383360522022,0.8451393609789258,1.0313538505996243,1.1125185285002022,0.8238337906703254,NA,NA
2024-01-10,Jan, Pioneering map of London shows the link between deprivation and road casualties,"The Vision Zero Inequalities Dashboard creates a new map of London, showing the stark levels of road traffic injury inequality in the capital
 
 




 ""We're delighted to publish this valuable new tool to enable people to see where and how action most needs to be taken to reduce road danger and inequality in London""
 
 Lilli Matson
 TfL's Chief Safety, Health and Environment Officer
 


 
TfL is publishing borough level data for the first time, allowing users to identify areas and issues that most urgently need to be addressed
In London the more deprived the area, the higher the risk that someone travelling in that area will be seriously injured or killed in a road traffic collision in that area, with the 30 per cent most deprived postcodes having more than double the number of casualties per kilometre compared with the least deprived 30 per cent 
Data shows how deprivation is linked to higher casualty levels, reinforcing the need to target improvements to protect those most vulnerable
Continued action is needed to achieve the Mayor's Vision Zero goal of eliminating death and serious injury from the transport network
Transport for London (TfL) has launched its Vision Zero Inequalities Dashboard tool, creating a new map of London that shows the stark levels of road traffic injury inequality in the capital. The pioneering new tool is the first of its kind in Europe and shows how deprivation is linked to higher road casualty levels, reinforcing the need to target investment and improvements to protect those most vulnerable.

The dashboard enables users to filter the data on the relationship between deprivation levels and road casualties by year, borough, casualty severity and mode of travel, while the mapping function makes it easier to explore areas of higher casualty or casualty location rates. The risk of death and serious injury on London's roads is an urgent public health issue and these tools will allow users to identify areas and issues that most urgently need to be addressed.

Casualty data available runs from 2017 up to the end of 2022 and will be updated annually.  Remaining data covering this time period on age and gender will be added later this year. London collision data is collected by the Metropolitan Police Service (MPS) and the City of London Police (CoLP) or reported to the police by members of the public.

TfL will use the data from this dashboard to inform its own investment priorities and provide this data to boroughs to develop their Local Implementation Plans (LIPs). TfL has met and shared the findings of this dashboard with the boroughs with the top five highest casualty rates and top five highest casualty location rates.  TfL will continue to work with boroughs and stakeholders to analyse the cause of inequalities in road injury, help target future road danger reduction programme planning and investment for infrastructure schemes and drive further action to reduce road danger inequalities and make London's streets safer. The Mayor of London is committed to creating a fairer, more equal and integrated city as set out in the Healthy Streets approach within The Mayor's Transport Strategy.  

The dashboard complements the Inequalities in road danger in London (2017-2021) report, published earlier this year, which focused on two areas, the collision location and the demographic characteristics of the people who are injured. This report found that in London the more deprived the area, the higher the risk that someone travelling in that area will be seriously injured or killed in a road traffic collision in that area, with the 30 per cent most deprived postcodes having more than double the number of casualties per kilometre of road network compared with the least deprived 30 per cent. The report found that the same is also true for people living in London's more deprived areas who are travelling in London as a whole. The more deprived the area someone lives in, the higher the risk they will be injured or killed in a road traffic collision wherever they are travelling in London, with people from the 30 per cent most deprived home postcodes having nearly double the risk of people from the least deprived 30 per cent. The dashboard shows that the data for people killed or seriously injured (KSI) in 2022 continues to show these trends.

Lilli Matson, TfL's Chief Safety, Health and Environment Officer, said: ""We're delighted to publish this valuable new tool to enable people to see where and how action most needs to be taken to reduce road danger and inequality in London. The interactive dashboard displays crucial information on the relationship between deprivation levels and road casualties in London. Protecting everyone on the road is a priority for us and we will continue to research how road risk varies for certain groups of Londoners and engage with boroughs, police and other stakeholders to reduce these inequalities. Without safe streets we know that people won't choose the most healthy and sustainable modes of transport and there is still much more to do to eradicate road deaths and serious injuries. We are determined to make London a greener, more sustainable and safer city for everyone.""

Jeremy Leach, Action Vision Zero, said: ""Poorer communities face much greater risk when using the roads.  Now though, communities and campaigners across London have a powerful new tool to help them to tackle road danger and make walking and cycling safer. TfL's new Inequalities Dashboard helps people to pinpoint places where risk is higher and demand action from their local Councillors and their borough.""

Deputy Leader Cllr Rezina Chowdhury, Cabinet Member for Sustainable Lambeth and Clean Air, said: ""Lambeth Council welcomes this move because in our borough people who live in deprived areas are nearly three times more likely to suffer an injury or be killed in a road collision.

""Our road danger reduction strategy, which was published in November, sets out how we will tackle this stark inequality, and the new Vision Zero Inequalities Dashboard will help us, and other London borough's collect the essential data needed to track progress.

""Road danger is a social justice issue, and we are past the point where it's enough to just ask motorists to slow down or pedestrians to look both ways when crossing a road. It is about making sure in the future streets are designed with road safety built-in, making them more equal and less dominated by motor traffic.""

TfL remains committed to its Vision Zero goal to eliminate death and serious injury from London's roads and transport networks by 2041. The dashboard represents one of TfL's commitments in the Vision Zero Action Plan progress report and demonstrates the vital importance of improving access to safe roads and travel options for everyone, but particularly for those in more deprived areas.

TfL is working in partnership with the boroughs, police and other stakeholders to directly tackle road danger and continues to work on a number of major programmes to make London's roads and the vehicles using them safer. TfL and boroughs continue to expand London's strategic cycle network at pace, with 24 per cent of Londoners now living within 400m of the network, up from 5 per cent in 2016. Construction works continue on Cycleway 50, Cycleway 23 and Cycleway 4, with many more routes being developed in partnership with boroughs. TfL has also continued to work on its Safer Junctions programme to make life-saving changes at some of the capital's most dangerous and intimidating junctions. This programme has so far reduced danger at 44 junctions across London, with work on the junction of Lambeth Bridge/Millbank set to start later this year.",0.2959848574467453,Wed,0.9,1.12,0.98,0.94,0.8,0.87,0.83,0.71,0.65,1.01956745623069,1.0344248530646516,1.0276453765490943,1.0177165354330708,1.0220673635307782,1.0020942408376963,1.0110741971207087,0.8068181818181818,0.8188976377952757,0.9519725557461407,0.9587599051419979,0.9464274061990211,0.9457511896668932,0.9940760005779512,1.008219916453308,0.9630733045864367,0.7430863254392666,0.7589704252961732
