date,month,title,body,mean_text_similarity,day,cars,light_commercial_vehicles,heavy_goods_vehicles,all_motor_vehicles,tfl_tube,tfl_bus,bus_excluding_london,national_rail,national_rail_noCR,cars_monthly_prop,light_commercial_vehicles_monthly_prop,heavy_goods_vehicles_monthly_prop,all_motor_vehicles_monthly_prop,tfl_tube_monthly_prop,tfl_bus_monthly_prop,bus_excluding_london_monthly_prop,national_rail_monthly_prop,national_rail_noCR_monthly_prop,cars_yearly_prop,light_commercial_vehicles_yearly_prop,heavy_goods_vehicles_yearly_prop,all_motor_vehicles_yearly_prop,tfl_tube_yearly_prop,tfl_bus_yearly_prop,bus_excluding_london_yearly_prop,national_rail_yearly_prop,national_rail_noCR_yearly_prop
2024-03-07,Mar, TfL publishes new Green Infrastructure and Biodiversity Plan to further support creating a greener city,"Transport for London (TfL) has published a new Green Infrastructure and Biodiversity Plan, as part of its continuing work to become the strong, green heartbeat for London, supporting the Mayor's ambition of a carbon-neutral London by 2030 and to tackle the nature emergency
 
 




 ""Butterfly Conservation welcomes TfL's commitment to restoring biodiversity and enhancing green infrastructure""
 
 Steve Bolton
 Big City Butterflies Project Officer at Butterfly Conservation
 


 
The plan, which fully aligns with TfL's Corporate Environment Plan, published in 2021, sets out how TfL will improve and care for green infrastructure and biodiversity across its estate and networks. It captures in one place, for the first time, its existing relevant targets, legal requirements and policy commitments, while also setting out the strategic actions TfL will take to deliver them. The plan was developed following a wide range of engagement within and outside TfL, including London's boroughs.

London is home to a remarkable variety of plant and animal species. From its lush green parks and gardens to its riverbanks and woodlands, the city provides a wide range of habitats. Green infrastructure and biodiversity - the variety of all living things and their interactions - provide a wide range of important benefits, such as helping the city adapt to climate change and encouraging active travel.

This new plan will ensure TfL meets a range of commitments to further enhance and support green infrastructure and biodiversity across London, including:

Achieving a 10 per cent biodiversity net gain on applicable schemes (i.e. planning system projects and Nationally Significant Infrastructure Projects) from February 2024
Delivering a net gain in biodiversity across TfL's estate by 2030, compared to the 2018 biodiversity baseline map
Boosting tree canopy cover across TfL by 10 per cent by 2050, compared with the 2016 baseline
Doubling wildflower verges to 260,000 square metres in 2024, and developing a longer-term plan to continue their introduction across London  
Ensuring 5,000 square metres of Sustainable Drainage Systems (SuDS), such as rain gardens, are installed on TfL's road network each year
Further reduce the use of pesticides across TfL and eliminate where operationally and financially feasible
As one of London's largest landowners, with more than 2,300 hectares across the capital, almost a third of TfL's land is covered by vegetation. This includes land which intersects two Special Areas of Conservation, six Sites of Special Scientific Interest, eight Local Nature Reserves and 139 Sites of Importance for Nature Conservation. TfL's wide variety of habitats, from woodland to wetland, support more than 1,000 animal species - such as a range of butterfly species and eight different species of bat within a disused railway tunnel at Highgate - as well as almost 700 plant species across London. Many of the species found on or near TfL's estate are legally protected and therefore it is important to protect their habitat.

In 2022, TfL was the first transport provider in the UK to carry out a natural capital account for its estate, to the high standards of the Natural Capital Protocol and the relevant British Standard. The account found that the benefits from TfL's natural capital assets that can be monetised have a current estimated gross asset value of £328m. While this is a significant figure, it is still likely to be an underestimate, and TfL is now planning on a range of biodiversity research and innovation projects to help fill in data gaps and improve future accounts.

Using this information, TfL will be able to make better decisions about how to manage its green infrastructure and increase biodiversity. TfL plans to double the area of wildflower verges alongside the TfL Road Network to 260,000 square metres in 2024. It will also explore potential ways to further increase biodiversity at these sites, which already support 17 different species of butterfly, five of which are London Priority species. TfL is also on track to meet its commitment to deliver an additional 5,000 square metres of Sustainable Drainage Systems (SuDS), such as rain gardens, on its road network each year. These nature-based solutions not only help support biodiversity but also help reduce the risk of flooding from storms.

Across London, TfL is also meeting its target to increase the overall number of street trees on its estate by one per cent per year between 2016 and 2025. A plan to help strategically increase tree canopy across TfL's estate by 10 per cent by 2050 will be published by March 2025. Tree canopies provide shelter from the sun as well as habitats for birds and wildlife.

The health of soil across London can affect its capacity to hold or drain water, and its ability to support particular habitats. The plan outlines how soil on TfL land will be protected from degradation or contamination, reducing the need for additional resources, such as fertiliser and compost. TfL also plans to eliminate the use of pesticides where operationally and financially feasible, having already reduced highways glyphosate use by 70 per cent in recent years.

TfL plays a key role in not only helping to protect, connect and enhance green and canopy cover across its own estate, but also in assisting in making other green spaces, such as parks and recreation grounds, accessible to the public. Providing sustainable travel access can help reduce social and environmental inequalities, so to inform this work, TfL will be mapping sustainable travel access to London's green spaces in relation to socio-economic factors by the end of 2025. This will help inform future investment decisions and ensure that those walking, cycling or taking public transport have clear and easy access to green spaces across the city.

Lilli Matson, Chief Safety, Health and Environment Officer at Transport for London said: ""As one of London's largest landowners, TfL has an extensive network of green corridors, from tree-lined streets to trackside woodland. Together, these play a crucial role in connecting London's green spaces for wildlife.

""Our new Green Infrastructure and Biodiversity plan forms part of our continuing work in creating a greener, more biodiverse city that is resilient and well adapted to climate change. By lowering the environmental impact of our business and offering a range of sustainable ways to travel across London, we can use our real estate and infrastructure to create a city that allows people and wildlife to flourish.""

Steve Bolton, Big City Butterflies Project Officer at Butterfly Conservation, said: ""Butterfly Conservation welcomes TfL's commitment to restoring biodiversity and enhancing green infrastructure. We have supported the expansion of the wildflower verges trail engaging local volunteers in butterfly recording and advising on planting schemes to support butterflies and moths. Improving biodiversity data, habitat quality and connectivity will help support the recovery of butterflies and moths so they can thrive in the urban environment and be enjoyed by everyone.""

Becky Garden, Partnership Officer at Greenspace Information for Greater London (GiGL), said: ""GiGL's contribution to TfL's Green Infrastructure and Biodiversity Plan, through their provision of robust environmental data, visualisations, and modelling, has allowed for an informed approach towards improving and protecting the environment. By providing comprehensive data insights into biodiversity and London's outdoor spaces, GiGL has enabled TfL to foster a plan that will benefit the well-being of people and nature alike. The collaborative efforts between TfL and GiGL facilitates the flow of data across London, from the collection, to use in informing decisions, as it has for the many years TfL has been partnered with GiGL.""

The publication of TfL's Green Infrastructure and Biodiversity Plan is just part of TfL's wider work to drive sustainability across London and become the strong green heartbeat of London. TfL is investing in further decarbonising its operations, including transitioning its support vehicles and buses. It remains on track to have a fully zero-emission bus fleet by 2034, and with Government funding, this could be accelerated to 2030, which would catapult the potential for new production models and help transform the bus industry in the UK.

TfL is working to remove fossil fuels across its building estate, as well as developing wider projects to improve energy efficiency and identify opportunities to generate renewable energy across its estate. Work to procure Power Purchase Agreements as part of its wider ambition to use 100 per cent renewable source electricity across TfL's operations by 2030 is ongoing.

Across London, TfL is also converting lighting within stations, bus shelters and on trains to LED lighting, which uses up to 60 per cent less energy than traditional lighting while providing around 10 per cent brighter light. Currently, more than a third of Tube stations across London have been converted to LED lighting, and TfL expects to have all bus shelters, including those used in advertising panels, converted to LED lighting shortly.

For more information, please visit www.tfl.gov.uk/biodiversity",0.343260951133464,Thu,0.95,1.14,1.04,0.99,0.82,0.85,0.94,0.94,0.84,1.0066225165562914,0.9956331877729256,1.004830917874396,1.0038022813688212,1.0371541501976285,0.9948792977322604,1.0224337185588035,0.9973474801061007,0.9940828402366864,1.0048599199542596,0.9758806177338192,1.0043719412724306,0.996057104010877,1.0189279005924,0.9850424471095539,1.0907095256762054,0.9838044308632543,0.9808233188442853
2024-03-08,Mar, TfL marks International Women’s Day with a range of events to encourage more women to join transport and engineering sectors,"A range of activities supported by TfL this International Women's Day encourages more women to join these exciting sectors
 
 




 ""This International Women's Day, we want to show that Transport for London offers women varied and rewarding career opportunities, and we hope that our efforts to do this will help women to see that every role at TfL is open to them""
 
 Patricia Obinna
 TfL's Director of Diversity and Inclusion
 


 
Six new internship placements for women will be introduced this summer as part of TfL's new Women in Bus and Coach initiative, and TfL's Women into Transportation and Engineering pre-employment programme (WiTnE) will offer up to 20 women the opportunity to experience working within transport and engineering later this year
TfL's Women's Staff Network host a series of talks this March celebrating the role of women at TfL, and women's achievements are celebrated through TfL's Engineering Icons Tube map and recognised in the re-naming of London Overground lines
This International Women's Day, Friday 8 March, Transport for London (TfL) is encouraging women to consider joining the transport sector and engineering roles through a number of events and activities.

While progress has been made to encourage more women into these sectors, TfL is working hard to continue making the industries more inclusive and representative, particularly in operational roles.

TfL is actively working to improve representation at all levels within its business through a range of different interventions. These include providing and promoting initiatives that encourage women to enter the transport sector, as well as addressing any barriers that prevent women from advancing to senior and higher-paying positions, particularly in operational areas.

Today, TfL is hosting the final of its schools challenge, Innovate, which has seen students design an innovation that could help TfL deliver on its vision of being a strong green heartbeat for London. The winning innovation will be announced at today's ceremony and will include a panel discussion hosted by senior women leaders from TfL and the engineering sector to mark International Women's Day. They will discuss their experiences of working in transport, to inspire more young people and particularly girls to consider careers in transport and engineering.

The London Transport Museum is hosting a Museum Late: Women on the Move today, which will spotlight the jobs women do to keep London moving, the journeys they have taken to get there, and will explore women's diverse experiences of travelling and working in the capital.

TfL's efforts to encourage more women to consider careers in transport and engineering are ongoing and throughout March, TfL's internal Women's Colleague Network Group is hosting several events to encourage more women to seek new opportunities in more male-dominated areas such as engineering and technology.

Last year, TfL launched the 'Women in Bus and Coach' initiative to help share expertise and develop solutions to ensure a career in the bus and coach industry is attractive to women of all ages, backgrounds and ethnicities. Several commitments to encourage women to join transport and engineering are in progress and the network will launch six new internship places specifically for women, this summer.

TfL's supplier skills team have also been actively working with suppliers to increase the number of women working in transportation, engineering and construction sectors. Later this year up to 20 women will be given the opportunity to experience working within these sectors through TfL's support of a Women into Transportation and Engineering pre-employment programme (WiTnE).

TfL is also actively supporting women's progression into senior management roles by launching a new 'Getting ready for Senior Leadership' programme designed to help better prepare internal colleagues for a move into senior leadership.

Deputy Mayor for Transport, Seb Dance, said: ""The Mayor and TfL are committed to diversifying and strengthening TfL's workforce and are working hard to attract more women to the transport and engineering sectors.

""This year TfL is marking International Women's Day with a number of events and activities, which we hope will encourage more women into these exciting and vital industries.""

Patricia Obinna, TfL's Director of Diversity and Inclusion, said: ""This International Women's Day, we want to show that Transport for London offers women varied and rewarding career opportunities, and we hope that our efforts to do this will help women to see that every role at TfL is open to them.""

Lina Shari who joined TfL's WiTnE programme, says: ""I hadn't considered transport as a career option but, following the programme, I'm now have a role as a Workflow Coordinator at Kier. The fact that the programme is specifically made to benefit women, and help them with their career path was key for me. This experience opened my eyes and made me aware of what happens on London roads every day.""

Last November, TfL, the Royal Academy of Engineering and the London Transport Museum created a reimagined version of London's iconic Tube map, honouring the contributions of engineers in London, the UK and worldwide. The Engineering Icons Tube map celebrates the achievements of many female engineers and was created to help encourage more people to consider engineering as a career.

The engineering profession in the UK is experiencing a concerning skills and diversity shortfall. Research shows that almost half (47 per cent) of UK pupils aged 11-19 have not considered engineering as a potential career [1]. According to the latest available data, only 16.5 per cent of the UK engineering workforce is made up of women, and Black and minority ethnic groups represent only around 11.4 per cent [2].

Later this year, two of London's six Overground lines will be renamed to recognise the historic contribution women have made to London. The Suffragette line will celebrate how the working-class movement in the East End fought for women's rights. The line runs to Barking, home of the longest surviving Suffragette Annie Huggett, who died at 103.

The Lioness line, which runs through Wembley, will honour the historic achievements and lasting legacy created by the England women's national football team that continues to inspire the next generation of women and girls in sport.",0.25824277865432016,Fri,0.96,1.13,1.02,1,0.76,0.87,0.92,1,0.9,1.0172185430463576,0.9868995633187772,0.9855072463768115,1.0139416983523448,0.9612648221343874,1.0182882223847842,1.0006798096532972,1.0610079575596818,1.0650887573964498,1.0154373927958833,0.9673202614379085,0.9850570962479608,1.0061182868796736,0.9443722005490536,1.008219916453308,1.0675029400235203,1.0466004583651642,1.0508821273331628
2024-03-11,Mar, Plan ahead for part closures of the Northern line starting next month to facilitate the major upgrade of Colindale Tube station ,"Part closures of the Northern line between Golders Green and Edgware in spring and summer 2024 will facilitate the major upgrade of Colindale Tube station
 
 




 ""I'd like to thank our customers in advance for their patience during these part closures of the Northern line which we appreciate will cause some disruption to people's journeys""
 
 Stuart Harvey
 TfL's Chief Capital Officer
 


 
First part closure will take place from 2 to 11 April 2024, with others over weekends in June and July  
 Track closures are necessary due to the proximity of some of the construction work to upgrade Colindale station to the track, meaning it cannot be safely carried out when trains are running  
Detailed travel advice for customers affected by these closures is available at TfL travel advice - Colindale  
Transport for London (TfL) is reminding customers that the first in a series of part closures of the Northern line between Golders Green and Edgware, to facilitate the major upgrade of Colindale Tube station, is next month.  

The first planned track closure will take place from Tuesday 2 to Thursday 11 April 2024. There will also be closures of the same section of the line over weekends in June and July this year.  

During these closures, there will be no Tube service to or from Brent Cross, Hendon Central, Colindale, Burnt Oak or Edgware Underground stations. Northern line trains will continue to run as normal to and from Golders Green, with a regular service on the rest of the Northern line. Rail replacement bus services will run between Golders Green and Edgware stations, and also to Canons Park station for Jubilee line services, during the track closure periods. Detailed travel advice, including alternative routes, for customers affected by these closures is available on TfL's website at TfL travel advice - Colindale.  

The part closures are linked to the major upgrade of Colindale Tube station which includes building a larger ticket hall and installing a lift to give the station step-free access for the first time. The station's major upgrade will mean it has to close from Friday 7 June until December 2024.   

The associated part closures of the Northern line are necessary due to the proximity to the track of some of the construction work to upgrade Colindale station - including piling, crane operation and demolition work - meaning it cannot be safely carried out when trains are running. During these closures, TfL will also take the opportunity to carry out additional track maintenance and engineering works which will help improve overall services along this section of the Northern line, offering a more reliable and comfortable service for customers.  

Stuart Harvey, TfL's Chief Capital Officer, said: ""I'd like to thank our customers in advance for their patience during these part closures of the Northern line which we appreciate will cause some disruption to people's journeys. They are essential in order to facilitate the complex work being carried out as part of the major upgrade of Colindale station. We are committed to doing everything we can to ensure that, through our detailed travel advice, customers can plan ahead and are able to complete their journeys using the public transport network.""  

The additional part closures of the Northern line between Golders Green and Edgware will take place on the following weekends:  

o   Saturday 8 - Sunday 9 June   

o   Saturday 15 - Sunday 16 June   

o   Saturday 29 - Sunday 30 June   

o   Saturday 27 - Sunday 28 July   

TfL has launched a widescale communications campaign ahead of the track closures and the temporary closure of Colindale station which includes targeted customer emails, posters and PA announcements at stations. TfL's Journey Planner and TfL Go will also be updated with the latest travel information. TfL is encouraging customers to use these real-time travel tools to plan ahead during these essential closures.  

ENDS ",0.2502772473312669,Mon,0.94,1.16,1.05,0.99,0.74,0.82,0.9,1,0.9,0.9960264900662251,1.0131004366812226,1.0144927536231882,1.0038022813688212,0.9359683794466402,0.9597659107534747,0.9789259007477906,1.0610079575596818,1.0650887573964498,0.9942824471126357,0.9930013303256405,1.0140293637846656,0.996057104010877,0.9195203005346048,0.9502762430939226,1.044296354370835,1.0466004583651642,1.0508821273331628
