date,month,title,body,mean_text_similarity,day,cars,light_commercial_vehicles,heavy_goods_vehicles,all_motor_vehicles,tfl_tube,tfl_bus,bus_excluding_london,national_rail,national_rail_noCR,cars_monthly_prop,light_commercial_vehicles_monthly_prop,heavy_goods_vehicles_monthly_prop,all_motor_vehicles_monthly_prop,tfl_tube_monthly_prop,tfl_bus_monthly_prop,bus_excluding_london_monthly_prop,national_rail_monthly_prop,national_rail_noCR_monthly_prop,cars_yearly_prop,light_commercial_vehicles_yearly_prop,heavy_goods_vehicles_yearly_prop,all_motor_vehicles_yearly_prop,tfl_tube_yearly_prop,tfl_bus_yearly_prop,bus_excluding_london_yearly_prop,national_rail_yearly_prop,national_rail_noCR_yearly_prop
2024-07-16,Jul, Part closures on the A40 from Sunday to enable vital safety and maintenance work to take place,"Critical safety maintenance work will replace joints on slip roads to the Westway structures, between the Wood Lane and Marylebone flyovers
 
 




 ""We're determined to ensure a safe and well-maintained road network can play a full role in enabling Londoners to travel across the capital""
 
 Stuart Harvey
 TfL's Chief Officer
 


 
The work will require slip road and directional road closures from Sunday until mid-October
Though closures have been carefully planned to minimise disruption as much as possible, diversion routes are expected to be extremely busy
The road is one of the main routes into London and the work will ensure it remains safe and reliable for decades to come
Further phases of vital work are currently being planned for later this year and coming years
Transport for London (TfL) is reminding drivers and others travelling in west London of critical safety maintenance work on the A40 from 22:00 on Sunday 21 July. TfL is working closely with its partners to minimise disruption.

TfL is responsible for the safe operation and maintenance of London's network of red routes, including the A40 Westway — one of London's busiest roads, carrying around 90,000 vehicles a day. The structures which carry the Wood Lane flyover to the Marylebone flyover date back to 1969 and are reaching the end of their serviceable life, meaning that they require safety critical maintenance to ensure they remain safe and can continue to serve Londoners for decades to come.

From Sunday 21 July, TfL will be replacing four joints which provide support to slip roads to the A40, as part of an ongoing programme of improvement work to the road network in the area. Road closures are essential for this work to take place and have been timed to minimise disruption as much as possible, with the most impactful works undertaken during the summer holiday period, when traffic flows on red routes are up to seven per cent lower, with 20 per cent less traffic in central London.

This work will be undertaken in two separate phases:

From 22:00 on Sunday 21 July to Thursday 22 August 2024, the eastbound slip road from the Westway Roundabout and the A3220 West Cross Route southbound between the Westway Roundabout and the Holland Park Roundabout will be closed to all traffic
From Monday 2 September to mid-October 2024, the westbound on slip from the A3220 West Cross Route to the A40 Westway via the Westway Roundabout will be closed.  The A3220 West Cross Route from Holland Park Roundabout to the Westway Roundabout will also be closed to northbound traffic
TfL is advising people that the A40 on approach to Wood Lane, diversion routes and local roads are expected to be extremely busy and that people should plan ahead, using alternative routes or transport modes where possible.  Full travel advice is available on the TfL website at tfl.gov.uk/westway.

TfL is also working closely with partners across London to ensure all work taking place on the road network this summer is co-ordinated as effectively as possible. This includes rescheduling other major works wherever possible and co-ordinating closely with the freight industry to ensure awareness of the closures. Work will be paused during the Notting Hill Carnival as part of TfL's work to minimise disruption.

TfL will be putting a comprehensive traffic signal strategy in place to try and keep traffic moving as smoothly as possible. This will be continually reviewed as part of our ongoing management of the road network.

Stuart Harvey, TfL's Chief Capital Officer, said: ""We're determined to ensure a safe and well-maintained road network can play a full role in enabling Londoners to travel across the capital. These ageing 1960s structures are reaching the end of their serviceable life and road closures are essential if we are to ensure they can continue to serve Londoners for decades to come. We recognise that these closures will have a significant impact on people travelling in the area and are working hard to minimise disruption as much as possible, including by rescheduling other work and reviewing traffic signals. I'd like to thank people in the area for their patience and would encourage everyone to plan ahead for any journeys in the area.""

The removal of TfL's Government operational grant in 2017/18, followed by the pandemic and a prolonged lack of certainty over Government financial support, had a severe impact on the investment available for refurbishment and maintenance work on London's road network. This has created a backlog of billions of pounds of maintenance works, requiring many years of sustained investment to address and ensure that the road network remains in good order. While TfL still lacks certainty over capital funding beyond 2024/25, tough decisions and work to reduce costs at TfL have enabled it steadily increase investment over the coming years, including along the A40.",0.3042264388898735,Tue,0.95,1.19,1.04,1,0.81,0.86,0.82,0.96,0.85,0.9872979214780601,1.00990099009901,0.9989327641408752,0.989010989010989,0.989145183175034,0.9954983922829581,1.0438472418670437,0.9953917050691244,0.9858247422680412,1.0048599199542596,1.0186823992133727,1.0043719412724306,1.0061182868796736,1.0065019505851756,0.9966311817814311,0.951470011760094,1.0047364400305576,0.9924997869257649
2024-07-18,Jul, London’s Superloop express bus network celebrates one year anniversary,"Latest TfL data shows increasing demand for the Superloop express bus services, with average growth on all Superloop routes since June 2023 nine per cent higher than network average
 
 




 ""The Superloop is making a real difference improving public transport in Outer London, adding more than six million additional bus kilometres per year to the capital's bus network and linking stations, town centres, hospitals and transport hubs""
 
 Sadiq Khan
 Mayor of London
 


 
Ridership on the first Superloop route - the SL8 - has increased by 18 per cent between June 2023 and May 2024
The Superloop has circled the entire capital since March, with a further route launching when Silvertown Tunnel opens in 2025
The 138km loop connects key locations across outer London, adding more than six million kilometres per year to the capital's network
One year ago, Transport for London (TfL) launched the SL8, the very first route to carry the Superloop branding. New data shows the average increase in passengers on all Superloop corridors (including parallel routes) since the June 2023 baseline is 11 per cent, nine per cent higher than the network average. Increasing numbers of customers are seeing the benefits of the game-changing network of express bus services, with new Superloop services adding more than six million bus kilometres per year to the capital's network, above the four million originally forecast. The Superloop network connects people using it with 310 other bus routes, 49 rail stations and 23 rail lines, improving outer London's connectivity.

The SL8 route, which runs between Uxbridge and White City, was the first of four existing routes to be renumbered over the summer last year to provide customers with an instantly recognisable express bus service in outer London. The route has the highest average weekday demand of all Superloop routes as patronage increased by 18 per cent between June 2023 and May 2024. Improvements on the SL8 included a change to the timetable with improved frequencies and expanded operating hours to provide more early morning and evening services, as well as USB charging and new priority seating.

The Superloop network is helping to increase bus patronage around London. The SL7, which launched on 19 August 2023 and replaced the previous X26 route between West Croydon and Heathrow Airport, saw the largest increase in Superloop patronage between June 2023 and May 2024, with there being a 91 per cent increase in journeys as a result of the doubling in service frequency. Once the change in patronage on parallel routes was taken into account, corridor demand increased by 21 per cent. Patronage on the SL6 route from Russell Square to West Croydon also increased by 20 per cent in the same period. Furthermore, growth on the five most recent routes to launch, SL1, SL2, SL3, SL5 and SL10 was 16 per cent higher in May than June 2023 in terms of average weekday corridor demand.

Bus ridership continues to grow across the network with 1.86 billion bus journeys made in 2023/2024. More than 95 per cent of Londoners live within 400 metres of a bus stop, with buses being the most accessible, sustainable and affordable form of public transport. The Superloop connects town centres, hospitals, schools and transport hubs and other key locations across outer London. Early ridership figures show that almost half of all Superloop journeys involve an interchange with another mode of public transport, showing the important role it is already playing in outer London's connectivity. Alongside the daily cap, the Mayor's Hopper Fare means customers can take unlimited journeys within an hour for just £1.75, saving Londoners money on multi-route journeys, and encouraging more sustainable travel.

The final route in the new Superloop network, SL4, will begin operating between Canary Wharf and Grove Park once Silvertown Tunnel opens in 2025.

Mayor of London, Sadiq Khan, said: ""The Superloop is making a real difference improving public transport in Outer London, adding more than six million additional bus kilometres per year to the capital's bus network and linking stations, town centres, hospitals and transport hubs.

""This new data shows that if you build it, people will come and use it, and this is just the start. I have bold ambitions to deliver even more improvements to London's bus network, including Superloop 2 which would double the number of Superloop services and support my aim to build a fairer, greener London for all.""

Nick Owen, TfL's Director of Buses, said: ""It is encouraging to see customer demand continuing to grow in response to a new express service in outer London within its first year of inception. The data shows it's already transforming travel with millions of journeys each year. Initial feedback is looking very positive and proving popular with customers as many of the Superloop routes are still relatively new. Work is not done however, and we continue to review customer demand and feedback to make sure we are always adapting to customers' needs and making improvements where needed.""",0.29453489726057014,Thu,0.97,1.18,1.04,1.02,0.84,0.88,0.82,0.97,0.87,1.008083140877598,1.0014144271570014,0.9989327641408752,1.0087912087912088,1.0257801899592944,1.0186495176848873,1.0438472418670437,1.0057603686635945,1.009020618556701,1.0260148656375072,1.010122042917462,1.0043719412724306,1.0262406526172672,1.0437798006068486,1.0198086511251854,0.951470011760094,1.0152024446142094,1.015852723088724
2024-07-18,Jul, TfL makes £80 million of funding available to boroughs to help make streets safer and improve bus journey times,"Funding includes up to £50 million available over the next three years for boroughs to deliver significant safety improvements to their local area
 
 




 ""We are delighted to announce two new funding opportunities available to boroughs to continue their vital work improving road safety and investing in bus priority and bus infrastructure""
 
 Penny Rees
 TfL's Head of Healthy Streets Investment
 


 
£30m also available to deliver transformational bus infrastructure and operational improvements in three successful boroughs
London's 33 boroughs are responsible for around 95 per cent of streets across the capital and are vital partners in making them safe, accessible and reliable for all
Transport for London is making up to £50 million of funding available for boroughs to improve road safety on borough roads, as well as £30 million of funding to improve bus journey times and increase bus ridership. London's boroughs play a key role in the planning and delivery of schemes that transform local areas and support the Mayor's Vision Zero goal of eliminating death and serious injury from the transport network, as well as improving opportunities for safe and active travel in local communities. They also help ensure that the capital's bus service is comfortable and easy for all to use, offers attractive journey times and provides the connections people need.

This funding is in addition to the £80.4 million of Local Implementation Plan funding allocated to London's boroughs in 2024/25 and will help boroughs to continue their vital work making the capital's roads safer and more attractive for people using public transport, walking and cycling.

TfL is providing a fund of £50 million available to boroughs over the next three years to deliver significant safety improvements in their local area by reducing speeds and tackling the city's most dangerous roads and junctions. The fund will be open to projects between £0.5 million and £5 million. Examples of schemes TfL will consider funding through Borough Safer Streets include:

Projects that look to improve safety by reducing speeding and help to reduce the risk and severity of collisions
Projects that develop improvements to protect vulnerable road users and improve safety for people walking and cycling
Road safety improvements in high-risk locations
TfL is also providing £30 million in funding to a new programme called Better Bus Partnerships, which will make up to £10 million available for three successful boroughs to deliver transformational bus infrastructure and operational improvements. This includes new bus priority measures to improve journey times, better management of road works to reduce delays to buses, improvements to stops and stations to make it easier to change between buses and other modes of transport, and improvements to streets to make it easier to walk to bus stops and stations.

Penny Rees, TfL's Head of Healthy Streets Investment, said: ""We are delighted to announce two new funding opportunities available to boroughs to continue their vital work improving road safety and investing in bus priority and bus infrastructure. Working closely with London's boroughs is central to achieving a cleaner, greener and healthier London by reducing road danger, improving air quality and encouraging active travel. We look forward to working closely with the boroughs to deliver projects that make our city greener, safer and better for everyone.""",0.2583013326464847,Thu,0.97,1.18,1.04,1.02,0.84,0.88,0.82,0.97,0.87,1.008083140877598,1.0014144271570014,0.9989327641408752,1.0087912087912088,1.0257801899592944,1.0186495176848873,1.0438472418670437,1.0057603686635945,1.009020618556701,1.0260148656375072,1.010122042917462,1.0043719412724306,1.0262406526172672,1.0437798006068486,1.0198086511251854,0.951470011760094,1.0152024446142094,1.015852723088724
2024-07-22,Jul, 2024 grant applications open for community groups to further boost walking and cycling,"Applications are now open for Walking and Cycling Grants London until 9 September 2024 
 
 




 ""I'm delighted that these groups will benefit from our walking and cycling grants, to help boost active travel in local communities and build a better, greener, more sustainable London for everyone""
 
 Will Norman
 London's Walking and Cycling Commissioner
 


 
More than £565,000 is available to fund at least 60 walking, cycling and community ideas grants to increase participation among traditionally underrepresented groups
Enabling more people from all backgrounds to walk and cycle is vital to creating a healthier, more sustainable transport network 
Applications for TfL's Walking and Cycling Grants London programme, with more than £565,000 of grant funding available for community and not-for-profit groups that encourage people to walk and cycle. Each successful applicant will receive up to £8,000 over two years with an opportunity to extend their project for another year and receive an additional £2,000. Walking and Cycling Grants London (WCGL) aims to enable more people to walk and cycle, addressing the barriers that prevent people from getting active and helping to make London a more sustainable, inclusive, and healthy city. All projects give participants the chance to connect with their local communities, learn new skills, get active and improve their physical and mental health.

Funded by TfL in partnership with The London Marathon Foundation, and administered by Groundwork London, the programme offers two types of grants for applicants. Walking and Cycling Grants can provide successful candidates with up to £8,000 over two years with an opportunity to extend their project for a further year with an extra £2,000. Applicants will be considered on the potential of their idea to benefit the local community and boost walking and cycling levels, particularly among communities who do not tend to walk or cycle.

Applications for Community Ideas Grants are also open to help kickstart smaller projects across London that are based on previous successes in other communities. Potential applicants to the scheme will be able to browse successful former projects on the Community Ideas Hub, and then apply for funding of £5,000 for a single year to replicate these in their local community.

Applicants for both types of grant will be given help and support throughout the application process and further support will be given to successful groups during delivery of their projects.

Applications for both grants can be accessed at wcgl.london and the application window for both programmes is open until 17:00 on 9 September 2024. Successful applicants are set to be announced in November 2024. Applicants can visit wcgl.london to find out more about the programme or contact wcgl@groundwork.org.uk.

London's Walking and Cycling Commissioner Will Norman said: 

'Local community organisations can play a vital role in enabling more people to choose walking and cycle for shorter journeys, particularly from groups that have historically been under-represented. That's why I'm delighted that these groups will benefit from our walking and cycling grants, to help boost active travel in local communities and build a better, greener, more sustainable London for everyone.'

Miranda Leedham, Head of Customer Marketing and Behaviour Change at TfL, said:

'Breaking down the barriers that prevent people accessing the numerous benefits of walking and cycling is such an important part of making the capital a healthier and more sustainable city for all. We're so proud to see more than 78,000 participants benefit from our Walking and Cycling Grants funding and are excited to see even more Londoners of all ages and backgrounds get active with our brilliant funding scheme.'

Mike Diaper, Interim Group Director Funding and Impact, London Marathon Foundation said: 

'We are delighted to partner with Transport for London to fund the next round of Walking and Cycling Grants London. The programme has already inspired thousands of Londoners to get active, bringing together communities to walk and cycle. The fantastic projects that London Marathon Foundation and TfL have supported have helped to remove barriers to physical activity whilst encouraging environmentally friendly travel. We look forward to funding more groups to inspire activity for all, regardless of age, ability or background.'

Martin Petry, Grants Manager at Groundwork London said: 

'Groundwork London is thrilled to partner with TfL and London Marathon Foundation, supporting thousands of Londoners to walk and cycle more regularly and safely. This programme is so important, especially to those groups that are underrepresented or face barriers to participation. We are looking forward to supporting projects in 2024/25 to introduce the benefits of walking and cycling to even more people across the capital.'

To date the scheme has helped more than 78,000 participants in 33 London boroughs to benefit from walking and cycling, with activities including rides for children with disabilities, led rides for members of the LGBTQ+ community, classes learning how to cycle or repair bikes, or walks for people suffering from ill health or isolation. Last year, 88 new projects were awarded funding through the scheme bringing the total number of projects supported since 2016 to 338.

Those awarded funding last year included a project for residents across Redbridge to support LGBTQ+ people who live, work, socialise or study in the borough. The Redbridge Rainbow Community runs a project called ""Redbridge Rainbow on the Move!"" which focuses on people from the LGBTQ+ community coming together to explore their local area, increase confidence in walking, build social connections and improve participants' mental and physical wellbeing.

Other projects included Like2Bike, which oversees a broad range of cycling activities in Hackney schools, from learning to ride and on-road training through to race days in the Young Hackney cycling league. Alongside these, they also organise marshaled group rides to school known as 'bike buses', after-school leisure rides and a bike loan library to lend refurbished bikes, supplied by Westminster Wheels, to pupils who don't have one. The grant from WCGL enabled them to buy more bikes, helmets and locks, cover the cost of ride leaders and pay for the promotion of the bike buses. The bike bus has become more and more popular and on their June bike bus, 56 pupils and nine parents took part. The plan is for the bike bus to eventually become autonomous, marshalled by parents and the school.

Simon Shaw, Chief Executive, Redbridge Rainbow Community, said:

'We're really pleased that a diverse mix of LGBTQ+ people and allies are benefiting from our monthly walks. People have thoroughly enjoyed exploring local green spaces (for some it was their first visit!), enjoying some group exercise, connecting with others and the thematic activities we've included on the walks. It's been great that local partners have been able to lead some of the walks and activities, such as forest bathing and exploring local heritage, flora and fauna.'

Darren Reynolds, Project Manager at Like2Bike, said: 

'With the WCGL funding we were able to buy refurbished bikes, plus helmets and locks, and pay for a ride leader and marshal to oversee our morning bike buses and after school rideout clubs. The funding also allowed us to expand our loan bike library, giving pupils who don't own a bike the fun and freedom that comes from having one.'

TfL's updated Cycling Action Plan 2, published last year, highlights the fundamental role cycling plays in making a greener, more progressive, modern city. The plan outlines why it is essential to broaden the appeal of cycling to a more diverse range of Londoners to ensure cycling levels continue to increase at pace and that all Londoners benefit from the health and economic benefits of cycling. TfL's research shows that people from under-represented groups are open to taking up cycling, but experience different barriers, and the plan outlines ambitious evidence-led measures to support these groups by addressing these barriers.

TfL and London boroughs have more than quadrupled the size of the London-wide strategic cycle network, from 90km in 2016 to more than 390km in June 2024. Delivering high-quality new Cycleways will support Londoners of all backgrounds and abilities to cycle safely, encouraging greater diversity in cycling.",0.27310459199245907,Mon,0.98,1.22,1.06,1.03,0.77,0.87,0.74,0.95,0.85,1.0184757505773672,1.0353606789250354,1.0181430096051227,1.0186813186813188,0.9402985074626866,1.0070739549839227,0.942008486562942,0.9850230414746544,0.9858247422680412,1.036592338479131,1.0443634681011047,1.0236867862969006,1.036301835486064,0.956798150556278,1.008219916453308,0.8586436691493532,0.994270435446906,0.9924997869257649
