date,month,title,body,mean_text_similarity,day,cars,light_commercial_vehicles,heavy_goods_vehicles,all_motor_vehicles,tfl_tube,tfl_bus,bus_excluding_london,national_rail,national_rail_noCR,cars_monthly_prop,light_commercial_vehicles_monthly_prop,heavy_goods_vehicles_monthly_prop,all_motor_vehicles_monthly_prop,tfl_tube_monthly_prop,tfl_bus_monthly_prop,bus_excluding_london_monthly_prop,national_rail_monthly_prop,national_rail_noCR_monthly_prop,cars_yearly_prop,light_commercial_vehicles_yearly_prop,heavy_goods_vehicles_yearly_prop,all_motor_vehicles_yearly_prop,tfl_tube_yearly_prop,tfl_bus_yearly_prop,bus_excluding_london_yearly_prop,national_rail_yearly_prop,national_rail_noCR_yearly_prop
2024-10-14,Oct, TfL invites Londoners to participate in active bystander training,"Hundreds of places on active bystander training sessions available thanks to TfL funding during National Hate Crime Awareness Week
 
 




 ""Ensuring Londoners' safety is the Mayor's number one priority, and tackling hate crime is a key component of our work to ensure that people can travel around our city with confidence""
 
 Seb Dance
 Deputy Mayor for Transport
 


 
Training builds on TfL's hate crime campaign that launched in 2021 and active bystander campaign that launched last year
Initially, 28 per cent of participants knew what to do if a hate incident occurred to someone else, rising to 87 per cent after the training 
This year, to mark National Hate Crime Awareness Week, Transport for London is funding hundreds of free Active Bystander Awareness sessions* over the autumn and winter, as part of its efforts to empower Londoners to safely take action when they encounter hate crime on the transport network.

Throughout National Hate Crime Awareness Week (12-19 October), TfL is working with the police to run a series of events across the transport network to raise awareness of hate crime and the work TfL is doing to tackle it, to help reassure those who may lack confidence to travel on public transport and empower Londoners to support their fellow passengers.

Many Londoners remain worried about hate crime, including people from Jewish and Muslim communities who have seen a significant rise in incidents in the past year. TfL is committed to tackling hate, intolerance and extremism and continues to take a zero-tolerance approach to all forms of abuse on its network. Thousands of frontline staff are trained to support customers, with more than 500 TfL enforcement officers and around 2,000 police and police community support officers patrolling the network.

To help support Londoners to speak up and support one another to prevent abuse or harassment, TfL is hosting free online Active Bystander Awareness training this autumn and winter. The interactive three-hour course is led by the identity-based violence prevention charity Protection Approaches, and was developed in partnership with the Britain's East and Southeast Asian Network. 

These sessions aim to empower people to take action to prevent or reduce harm when they encounter hate crime by looking at how to respond to a series of hypothetical scenarios. With the course partly funded by the Mayor's Shared Endeavour Fund, TfL has added to this funding to expand the training to even more Londoners. The sessions will be held from late October to early December, are aimed at all Londoners and require no previous knowledge.

More than 200 Londoners benefitted from the free training last year with participants consistently providing positive feedback and reporting increased confidence in dealing with hate crime incidents. At the start of the sessions, 28 per cent participants knew what to do if a hate incident occurred to someone else, rising to 87 per cent after the training. 

Deputy Mayor for Transport, Seb Dance, said: ""Ensuring Londoners' safety is the Mayor's number one priority, and tackling hate crime is a key component of our work to ensure that people can travel around our city with confidence. It's brilliant to see these important training sessions being offered to even more Londoners, as part of our efforts to build a safer, fairer and greener London.""

Siwan Hayward, TfL's Director of Security, Policing and Enforcement, said: ""Over the last year we've seen an abhorrent increase in hate crimes directed at Jewish and Muslim communities which must be stopped. We are determined to eradicate hate crime in all its forms from London's transport network. 

""During National Hate Crime Awareness Week, we are encouraging Londoners to become active bystanders by funding hundreds of places on Active Bystander training sessions with Protection Approaches. These sessions have already empowered hundreds of Londoners to speak up and support one another to prevent abuse or harassment. I would really encourage Londoners who are keen to find out how they can support victims of hate crime to sign up.""

Andy Fearn, Co-Executive Director of Protection Approaches, said: ""Events over the past year have led to more and more Londoners to ask what they can do to help if they encounter hate. Whether it's an inappropriate comment in the workplace, harassment on the Tube, or a physical assault in the street, our Active Bystander training is proven to help people feel more confident and equipped to act safely and in ways that ensure the best outcomes for victims. We're delighted to be partnering with TfL and to be providing this training for its passengers. Together, this work will make London that little bit safer.""

Tom Naughton, Chief Superintendent of Metropolitan Police Service said: ""London's transport network is a space for everyone, and it is our collective responsibility to ensure that it remains safe, inclusive, and welcoming for all people, regardless of their race, religion, sexual orientation, gender identity, or any other characteristic. Hate crimes not only harm individuals but also undermine the strength and unity of our diverse city.

""The Metropolitan Police Service, in collaboration with TfL, is dedicated to preventing hate crimes and supporting victims. We work tirelessly to ensure that incidents are reported, investigated, and addressed with the seriousness they deserve. We encourage all Londoners to report hate crimes, whether they are victims or witnesses. By working together with our partners, local communities, and support networks, we can build a city where everyone feels safe and valued.""

Chris Casey, Chief Superintendent of British Transport Police said: ""We stand strong in our fight against hate crime and we will listen to, and act swiftly in response to, concerns raised by those travelling on the network.

""Abuse, intimidation or violence will never be tolerated and initiatives like the Active Bystander Awareness sessions will further our work to banish these behaviours and allow individuals to feel empowered in supporting their fellow passengers.

""We will continue to work with our policing, rail and community partners to ensure we are doing everything in our power to protect you and make you feel safe."" 

Michael Roberts, CEO of London Travelwatch, said: ""Our ongoing research into personal security on London Transport, and our report Out in London, highlighted the worrying scale of hate crime and harassment on London transport, but also showed the high percentage of people that felt it wouldn't be safe to intervene if they witnessed such a crime. 

""The excellent Active Bystander Awareness training sessions will help educate and empower Londoners to take action if they witness any form of hate crime, and will contribute towards a safer transport system for everyone."" 

A hate crime is any crime perceived by the victim or any other person to be motivated by hostility on the grounds of race, religion, sexual orientation, disability or transgender identity. One of the themes for this year's National Hate Crime Awareness Week is tackling hate crime that LGBTQ+ people experience. A report from London TravelWatch last year, Out in London, showed that 21 per cent of survey respondents experienced hate crime within the last year while travelling on London's transport network and 65 per cent of respondents who had experienced abuse or harm said bystanders had witnessed the event but did not intervene, with many respondents expressing they would not feel safe themselves to do so. 

TfL launched Equity in Motion last year, a plan with more than 80 actions to make London transport fairer, more accessible and more inclusive. By 2026, focussed research and engagement will look to better understand the experiences of disabled customers, women and girls, and LGBTQ+ people and their concerns about safety and security, and in the following year, frontline staff will be provided with training, guidance and tools to support victims of sexual violence and harassment, and hate crime.

*The free half-day active bystander training courses are now available to book here https://www.eventbrite.com/cc/active-bystander-training-transport-for-london-3680839.",0.2866998702824399,Mon,0.96,1.23,1.08,1.01,NA,NA,0.92,0.95,0.85,1.0084033613445378,1.0318791946308725,1.0259658011399622,1.0073138297872342,NA,NA,1.0360360360360361,0.9687287559483344,0.9695817490494296,1.0154373927958833,1.0529238243970156,1.0430016313213704,1.0161794697484705,NA,NA,1.0675029400235203,0.994270435446906,0.9924997869257649
2024-10-16,Oct, TfL steps up enforcement against persistent ULEZ penalty charge evaders,"£25.6million debt recouped by enforcement agents over 12 months following non-payment of penalties
 
 




 ""The most recent data shows that on average, over 96 per cent of vehicles seen driving in the ULEZ are compliant""
 
 Alex Williams
 TfL's Chief Customer and Strategy Officer
 


 
More than 1,400 vehicles seized over the course of a year and over £700,000 recouped by sale of vehicles belonging to persistent non-payers 
Vast majority of vehicles driving in the zone are now compliant, and drivers encouraged to sign up to Auto Pay to avoid being fined
Support available for those in difficult circumstances struggling to pay PCNs 
Additional steps to recover debt, including seeking County Court Judgements considered against those that refuse to pay
TfL is tripling the number of people in its investigations team to boost the work with enforcement agents
Transport for London (TfL) is cracking down on drivers who persistently evade penalty charge notices (PCNs) issued for Ultra Low Emission Zone (ULEZ) contraventions.

A cohort of people who refuse to pay multiple PCNs means that a significant amount of debt remains outstanding, which could be reinvested into improving the transport network for the benefit of all Londoners.

TfL is tripling the number of people in its investigations team to boost the work with enforcement agents to target those in polluting vehicles that refuse to pay the daily charges. Boosting its intelligence-led approach will be used in tandem with other enforcement action including the ability of bailiffs to visit an evader's address, clamp a vehicle, remove a vehicle and sell it at auction. This is in addition to the further fees that evaders accrue when they do not to pay the fine within the statutory time limit.

On 29 August 2023, the Ultra Low Emission Zone expanded London-wide to help tackle the triple challenges of air pollution, the climate emergency and traffic congestion. In London, around 4,000 premature deaths are attributed to toxic air each year, as well as increased risks of asthma, cancer and dementia. Air pollution also disproportionately affects poorer Londoners, and those from Black, Asian and minority ethnic communities. Any income generated from the scheme is being reinvested back into public transport, including improving bus routes in outer London. The scheme is not designed to generate revenue, as TfL wants all cars to be compliant.

The latest data shows that over 96 per cent of vehicles seen driving in the zone comply with the emissions standards, meaning the vast majority of drivers do not need to pay the daily charge. TfL's cameras check the number plates of vehicles driving in the zone, and if no charge is paid for a non-compliant vehicle within three days of the journey taking place, and no Auto Pay arrangement is in place, a penalty charge notice (PCN) is sent to the registered keeper. If a vehicle's registered keeper does not pay the penalty, it is registered as an unpaid debt and an order made for its recovery. If still not paid this leads to a Court-issued warrant, and enforcement action to recover the outstanding debt.

If a registered keeper ignores a warrant, bailiffs visit their address to recover money owed. In July, a driver with 45 warrants against them was traced by TfL agents to a new address. They claimed that they no longer owned the vehicle, but TfL's investigations team established that the PCNs were received before the vehicle was sold. The driver settled their balance of almost £16,000. Another repeat offender with 21 warrants against their vehicle was visited multiple times by TfL enforcement agents and made a series of payments to settle their outstanding debt of over £7,800.

Enforcement agents also have the power to seize particular belongings of the debtor, and use the proceeds to satisfy any outstanding debt. In August, a car was located, seized and removed after ignoring ten warrants. The driver in question had been issued with a total of 43 letters and been visited by bailiffs five times previously. Between August 2023 and July 2024, 1,429 cars were seized and removed by bailiffs. Between August 2023 and July 2024, 761 seized cars were auctioned, recovering £710,147 of debts accrued by the minority who refuse to pay the ULEZ charge.

TfL encourages anyone who has received a ULEZ penalty charge to engage with the notice. Staff work proactively with the registered keeper to reach a solution, including setting up payment plans where appropriate, to make fines owed more manageable, and signposting to charities and resources so that they can directly seek any assistance they need.

Alex Williams, TfL's Chief Customer and Strategy Officer, said: ""The most recent data shows that on average, over 96 per cent of vehicles seen driving in the ULEZ are compliant.

""We want to send a clear message to vehicle owners that if you receive a penalty charge for driving in the zone, you should not ignore it. Your penalty will progress to enforcement agents to recover the fines that you owe, and there is a risk that your vehicle and other items of property will be removed.

""The aim of the ULEZ is to clean up London's air and remove old polluting cars from the road so no drivers need to pay and no fines occur. There is only a small minority of drivers who are eligible for the charge, and even fewer who are refusing to pay - but we encourage anyone experiencing financial difficulties not to ignore PCNs, and to engage with our staff, who will work with you towards a resolution, including setting up debt payment plans.""

TfL encourages drivers to sign up to its Auto Pay system, which enables customers to be billed automatically when their vehicle enters the ULEZ and therefore avoids a fine. Customers registered with Auto Pay are debited on a monthly basis for daily charges and receive a monthly statement of the charges. Those registered with Auto Pay holders have 90 days to dispute any charges debited.

All penalty charge notices - a statutory notice - are sent with a guidance leaflet written in clear, uncomplicated language, offering advice on what the PCN means, how to challenge one and how to avoid receiving one in future. TfL's website also provides further detail on how to make a representation, how to appeal the outcome of a representation, and a document outlining the rights of the recipient in relation to enforcement agents.

A pilot scheme to offer increased support to vulnerable recipients of penalty charges is set to be introduced in the coming months. The scheme will include new guidance for TfL staff to assist those experiencing hardship, such as referring to a partner organisation which provides financial guidance.

The introduction of the London-wide ULEZ in August 2023 was supported by a £210million scrappage scheme, open to all Londoners, small businesses, and charities with non-compliant vehicles. The scheme has seen funding committed to around 54,700 applicants to help them transition to cleaner, greener modes of transport and avoid paying the daily charge.",0.20127790709764198,Wed,0.93,1.2,1.06,0.99,NA,NA,0.88,1,0.89,0.9768907563025211,1.0067114093959733,1.006966434452185,0.9873670212765958,NA,NA,0.990990990990991,1.0197144799456153,1.015209125475285,0.9837049742710121,1.0272427555092833,1.0236867862969006,0.996057104010877,NA,NA,1.0210897687181497,1.0466004583651642,1.0392056592516832
2024-10-16,Oct, First new Piccadilly line test train arrives in London,"The first of the capital's new Piccadilly line trains arrived in London on Monday 14 October, ahead of a programme of rigorous testing
 
 




 ""It's an exciting moment for London as testing begins on the new Piccadilly line trains""
 
 Sadiq Khan
 The Mayor of London
 


 
The new state-of-the-art Piccadilly line trains will start entering service by the end of 2025 with the full fleet of 94 trains expected to be rolled out by the end of 2027
The train was pulled by rail locomotives from its test track in Wildenrath, Germany to London, via the Channel Tunnel, covering a distance of around 400 miles
The new trains feature walk-through carriages, wider doorways, digital customer information screens, CCTV cameras and, for the first time on a Deep Tube train, air-conditioning
Trains will be more energy efficient, consuming 20 per cent less energy than the existing fleet
Transport for London (TfL) has welcomed the first of the new Piccadilly line trains to the capital, ahead of a programme of intensive testing before the new trains start entering service by the end of 2025.

The test train is the first of a fleet of 94 new trains that are being built for TfL by Siemens Mobility to replace the existing fleet which is nearly 50 years old. They are part of a £2.9bn modernisation programme which will boost journey times, train frequency and reliability as well as making the Piccadilly line more accessible and sustainable.

Around 80 per cent of the new trains will be built at Siemens Mobility's new factory in Goole, East Yorkshire, which was officially opened earlier this month. The test train was built in Siemens Mobility's factory in Vienna, Austria and has spent the last year on the test track in Wildenrath in Germany. From there, it made its 400-mile journey to London where it will undergo a period of commissioning activities before rigorous integration testing begins to ensure it is compatible with existing infrastructure on the Piccadilly line. Testing will initially take place overnight during engineering hours and some planned closures, with test trains running during the day in gaps between normal services as the date of their introduction gets closer.

The new Piccadilly line trains are set to transform the journeys of millions of customers on one of the Underground's busiest lines. The nine-carriage trains will increase capacity by around 10 per cent and feature walk-through, air-conditioned carriages, wider all-double doorways to help customers get on and off more easily, enhanced digital display screens for real-time customer information, and on-train CCTV cameras for additional customer security. The trains are lighter than existing designs which means they are more energy efficient and provide a smoother ride for customers, consuming 20 per cent less energy.

All of the new Piccadilly line trains are expected to be in service by the end of 2027 when the frequency of trains will increase from the current 24 trains per hour to 27 trains per hour.

The Mayor of London, Sadiq Khan, said: ""It's an exciting moment for London as testing begins on the new Piccadilly line trains. These state-of-the-art trains - most of which will be manufactured here in the UK - will be more spacious, equipped with CCTV cameras and, for the first time ever in a Deep Tube train, air-conditioned, to make everyone's journeys more comfortable.

""These new trains are just one example of the work we're doing to continue delivering the world-class transport network Londoners deserve, building a better, greener London for everyone.""

Stuart Harvey, TfL's Chief Capital Officer, said: ""The countdown is on for the next generation of Tube trains to start serving London, with the arrival of the first, new Piccadilly line train in the capital this month. These new trains are going to transform the experience of millions of our customers, providing a more frequent and reliable service on walk-through, air-conditioned trains with a host of features that will make journeys quicker, easier and more comfortable. We now have a year of rigorously testing the new trains before we start bringing them into service by the end of 2025.""

Sambit Banerjee, Joint CEO at Siemens Mobility, said: ""I'm delighted that the first new Piccadilly line train has arrived in London for testing, an exciting milestone made possible by the great partnership between Siemens Mobility and TfL. With 80 per cent of the new Piccadilly line trains being assembled in our new state-of-the-art Rail Village in Goole, Siemens Mobility and TfL are working together to back British jobs and transform rail travel in the capital.""

The scale of the Piccadilly Line Upgrade, which is taking place on one of London's deepest Tube lines with some of the oldest track and signalling infrastructure, means that a series of closures are ongoing to complete vital track and platform upgrades. TfL is also using any part closures as an opportunity to complete additional depot, signalling, power supply and track maintenance work to help keep the line in the best condition possible to provide a safe and reliable service for customers.

TfL is also progressing work on plans to upgrade and extend the Bakerloo line, with the immediate priority securing the long-term capital funding certainty that would allow the replacement of the existing 36-train Bakerloo line fleet. At over 50 years old, it is the oldest operating in daily passenger service anywhere in the UK. Securing a new fleet of trains, which the Siemens Mobility factory in Goole would be expected to deliver, and signalling would transform the Bakerloo line, boosting accessibility, reliability and comfort for the millions of customers who use it each year.",0.2688963937635967,Wed,0.93,1.2,1.06,0.99,NA,NA,0.88,1,0.89,0.9768907563025211,1.0067114093959733,1.006966434452185,0.9873670212765958,NA,NA,0.990990990990991,1.0197144799456153,1.015209125475285,0.9837049742710121,1.0272427555092833,1.0236867862969006,0.996057104010877,NA,NA,1.0210897687181497,1.0466004583651642,1.0392056592516832
